企業名,title,cocntent
ビジョナル,がん検診費用補助,子宮頸がん検診、乳腺超音波、乳腺マンモグラフィ、前立腺がん検査をはじめとする各検査を、会社負担にて受診できる制度です（諸条件有り）。
ビジョナル,インフルエンザ予防接種,全従業員（パート・アルバイト、派遣社員、業務委託も含む）、及び社員の扶養家族も対象に、全額会社負担で予防接種を受けられる制度です。
ビジョナル,アニバーサリー休暇,有給休暇や夏季休暇、年末年始休暇のほかに、年間で1日、「大切な誰かや自分」のために自由に休暇を取得できる制度です。「関わるすべての人が幸せになる事業づくり」を目指すVisionalだからこそ、大切な人と過ごす時間を増やしたいと考えています。
ビジョナル,持株会制度,社員の皆さんとともにVisionalの中長期かつ持続的な成長を目指すため、正社員・契約社員が、一定の条件のもとにビジョナル株式会社の株式を取得できる制度です。各社員の拠出金に対して奨励金も支給されます。
ミクシィ,住宅手当・住宅賃貸/分譲物件サポート,"渋谷駅から届出住所まで直線3km以内の方に月3万円を住宅手当として補助しています。
また、提携先の不動産仲介業者を利用いただくことで、物件購入・賃貸の契約成立時に社員優待を受けることができます。"
ミクシィ,転居費用/転居時交通費補助,株式会社MIXIの正社員として入社のため、遠方から引越しされた場合、その費用を会社で補助します。（条件/上限金額あり）
ミクシィ,社内カフェ(BYRON BAY COFFEE),BYRON BAY COFFEE(バイロンベイコーヒー)のドリンク・フードメニューを半額補助で提供しております。
ミクシィ,ドリンクバー,コーヒー、紅茶、スープなどを各種取り揃えたドリンクバーを設置しており、社員なら誰でも無料で利用できます。
ミクシィ,ランチ代サポート,社内食堂を利用の際に、半額補助しております。
ミクシィ,企業型確定拠出年金,一定の金額を毎月拠出して、加入者個人が金融商品（定期預金、投資信託等）で運用し、形成した資産を60歳到達後に年金または一時金として受け取る制度です。
ミクシィ,ミクブレ（リフレッシュ休暇）,"『ミクブレ』とはMIXI BREAK（ミクシィブレイク）の略称であり、勤続在籍期間5年ごとに、5日間のリフレッシュ休暇とインセンティブをセットで支給します。
※休職・産休期間はカウントに入りません。"
ミクシィ,Appleギフトカード/Google Playカード購入補助,有料アプリやアプリ課金の利用体験の促進を目的とした制度で、「Apple Gift Card」または「Google Play ギフトカード」の購入金額の50%を補助します。（上限あり）
ミクシィ,従業員持株会,社員の財産づくりをすすめる一策で、天引きにより一定金額を拠出し、株式会社MIXIの株式を購入する制度です。
ミクシィ,病児保育＆ベビーシッター補助制度,"お子様が病気の時にも働ける手段を提供することによって時間的制約の軽減をはかります。
病児保育やベビーシッター会社、ファミリーサポート等の保育サービスを利用した際の利用料の半額を補助します。（上限金額あり）"
ミクシィ,健康保険組合(ITS)によるベネフィット,当社加入の健保組合保険証の提示にて、提携機関 (保養施設、スポーツ施設、レストラン、会議室など) を利用できます。
ミクシィ,安全衛生・災害対策,感染症対策のため、各フロアに手指消毒ジェルや不織布マスクを配置しています。体調不良の場合には、専属の産業医・保健師への健康相談や、救護室の利用ができます。また、もしもの災害時の対策として、安否確認システムの導入や、防災グッズの設置なども進めております。
ミクシィ,オフィスグッズ,"社内のスペースにオフィスグッズを用意しています。
文房具,ティッシュ,ファイル,封筒,手提げ袋など、必要に応じて使っていただくことができます。"
ミクシィ,マッサージルーム,あん摩マッサージ指圧師の免許を有した施術師のマッサージを受けられます。（事前予約制、1回あたり最大30分まで）
マネーフォワード,従業員持株会,毎月の給与から一定の金額（拠出金）を控除し、マネーフォワードの株式を買付できる制度。拠出金に対して15％の奨励金も支給されます。
マネーフォワード,企業型確定拠出年金,毎月の給与から一定の金額（拠出金）を控除して積み立てし、従業員が資産運用する制度。拠出金分は非課税になるなど、節税メリットもあります。
マネーフォワード,"『マネーフォワード ME』
プレミアム無料クーポン",年に1度、『マネーフォワード ME』のプレミアム機能が無料で使えるクーポンを配布します。従業員とその家族が利用可能です。
マネーフォワード,健康診断,定期健康診断の他、婦人科検診も会社負担で受診できます。
マネーフォワード,予防接種,インフルエンザ予防接種を会社負担で接種できます。
マネーフォワード,医療サポート,病気やケガに関する悩みや、救急医療機関について24時間365日電話で相談することができる『メディカルアシスト』のほか、夜間や休日に往診やオンライン診療が受けられる『ファストドクター』を導入しています。
マネーフォワード,職種別グレードによる人事評価制度,職種別にグレードを設定し、自身のステージに求められる役割、目指すステージに何が足りないのかを明確にした上で年2回評価を行っています。
マネーフォワード,チャレンジシステム（異動公募制度）,年に2回、各部署が社内向けに公募を行い、異動希望部署に自ら応募ができる制度。柔軟な社内異動によりキャリア形成を支援することを目的としており、毎回複数名の異動実績があります。
マネーフォワード,書籍購入補助,業務上必要な書籍を経費で購入することができる制度。購入後は社内本棚に寄贈され、全社員に共有されます。
マネーフォワード,開発環境構築支援,エンジニアはVP of EngineeringまたはCTOによる決裁で、最新のPC・必要なスペックのPCが利用可能です。また、業務上必要な備品は、品目の制限なく、会社費用で購入可能です。
マネーフォワード,"テックカンファレンス
コミュニティへの参加支援",国内外のテックカンファレンス・コミュニティへのスポンサー、出展をしており、参加費用を会社が負担します。
マネーフォワード,Happy Hour（社内懇親会）,コミュニケーションの活性化を目的として、全従業員が無料で参加できる懇親会を、実施しています。
マネーフォワード,Family Day,従業員の家族を招待し、マネーフォワードの仕事や職場を知っていただくための、オフィスツアーや懇親会を開催しています。
マネーフォワード,リモートワーク環境,全メンバーがリモートワークで自宅勤務できる環境を整えています。一方で、適切なオフラインコミュニケーションも重要だと考えており、原則週2日（推奨は週3日）のオフィス出勤をしております。オフィス内はフリーアドレスで、メンバーはGoogleカレンダーなどでお互いの出社状況を共有し合いながら働いています。
マネーフォワード,近隣住宅手当・近隣引越祝金,所属オフィス近隣に居住する際、最大2万円の近隣住宅手当を支給します。また近隣住宅手当の範囲内に新たに転居した際、祝金10万円を支給します。
サイボウズ,働き方宣言,個人のライフスタイルにあわせて、勤務時間や場所を選べる制度です。所属するチームと相談の上、自分の希望する働き方を決められます。また、サイボウズではメンバー全員の働き方が全社に向けて公開されています。
サイボウズ,ウルトラワーク,働き方宣言で決めたものとは異なる働き方をする場合に利用できる制度です。一時的な働き方の変更に対応するために作られた制度なので、ウルトラワークの利用が続く場合は基本となる働き方宣言の内容を見直す必要があります。
サイボウズ,複業,"複業は、その他すべての私的活動と同様に、原則個人の自由です。
サイボウズでは、メンバー１人ひとりが複業におけるリスクや注意点を認識した上で、複業を実施することができます。"
サイボウズ,リモートワーク環境手当,"リモートワーク環境を整えることを目的に、勤務時間や勤務日数に関わらず1人につき月5,000円が支給されます。ただし、契約の所定労働時間が月80時間以下の場合は月2,500円です。"
サイボウズ,カフェ代,仕事場所を確保するためにカフェを利用した場合、カフェ代を経費として申請できます。往訪などの外出時にスキマ時間を有効活用して、業務効率を向上させることを目的にしています。
サイボウズ,プロアクティブ休暇,働き方と一緒に休暇の活用(休み方)も模索し、主体的に自分らしく、休暇を活用しながら働けるようにと、年に５日、取得要件を限定しない休暇を取得できます。
サイボウズ,ケア休暇,"自分や家族の傷病（看護・介護）や療養でお休みが必要な時に、年に5日の休暇を取得できます。家族とは、詳しく以下を指します。

配偶者／事実婚・同性婚のパートナー／父母／子／配偶者の父母／事実婚・同性婚のパートナーの父母／祖父母、兄弟姉妹、孫／上記以外の家族で会社の認めた者"
サイボウズ,育児休暇,最長6年間の育児休暇制度です。子どもが小学校に通えるようになるまでを限度とし、必要ならば復帰後に再度休暇を取得することも可能です。取得期間も家庭の状況や本人の希望にあわせて柔軟に設定でき、女性だけでなく男性メンバーの取得も多いです。
サイボウズ,子連れ出勤制度,「学童保育に行きたがらない」「子どもの預け先が無い」といった場合に臨時に利用できる制度で、チームの生産性を下げないなどのルールのもと、緊急時の受け皿として機能しています。
サイボウズ,大人の体験入部,キャリアの検討や現在の業務へ活かすことを目的に、他部門に一時的に兼務・異動ができる制度です。海外を含むすべての拠点・部門に希望を提出可能です。
サイボウズ,Myキャリ,自分の「できること」と今後の「やりたいこと」をkintoneに記入して全社に公開し、メンバーとチームのマッチングを検討できる制度です。現状の知識とスキルを棚卸しして、将来のキャリアを自主的に考えられる機会としても利用されています。
サイボウズ,育自分休暇,最長6年の間、サイボウズへの復帰が確約された状態で退社できる制度です。別の分野や海外への長期渡航など、新しいチャレンジに取り組むメンバーに「またチームに戻れる」という安心感を持ってもらうことが目的です。
サイボウズ,従業員持株会,"従業員持株会は、従業員が給与控除により毎月一定の金額を拠出することで、サイボウズで働きながら、サイボウズ株を継続的に購入できる制度です。

従業員の中長期的な資産形成を支援することはもちろん、従業員自身が株主になることでよりオーナーシップをもって仕事に取り組めるようにするため、サイボウズではメンバーの希望する拠出金に対して100％の奨励金を支給しています。なお、拠出金は月額給与の10%を上限とします。"
サイボウズ,チムビル制度,"対面の場でのチームビルディングを目的とした活動を支援することで、チームメンバー間の相互理解やコミュニケーションを促進し、
リモートワークが主体となった環境下でのチームワークを向上させることを目的とした制度です。"
ZOZO,全国在宅勤務制度（開発部門）,国内のどこに居住していても就業可能な制度で、在宅勤務やオフィス外で作業を行うことが可能です。
ZOZO,フルフレックスタイム制度,始業時刻・終業時刻を日単位で選択できる制度です。コアタイムがないため、月間所定労働時間を満たしていれば、1日あたりの勤務時間を自由に選択することができるので、⽣活と業務との調和を図りながら効率的に働くことが可能です。
ZOZO,副業OK,他社での雇用をのぞき、本業に影響がない範囲で副業が可能（申請許可制）
ZOZO,適切なデバイスの貸与,ラップトップ、外部ディスプレイなど、最大のパフォーマンスを発揮するために必要なデバイスを、担当業務に応じて提供します。
ZOZO,住宅リモート手当,"全社員を対象に、毎月一律5万円を支給します。

エリアの指定なし。出社に伴う交通費は別途実費支給"
ZOZO,通勤手当,出社に必要な交通費を月額上限15万円まで実費支給。飛行機や新幹線での出社も可能です。
ZOZO,従業員割引制度,ZOZOTOWNでの買い物をする際の割引制度です。割引率は非公開ですが、従業員は制度を使ってサービスを積極的に利用し、その気づきをサービスづくりに活かしています。
ZOZO,ZOZOコネ,オフィスや物流拠点の周辺の飲食店などで優待を受けることができる従業員向け優待制度です。地域と繋がりを持ち、共に街を盛り上げていきたい、会社のことを地域の皆様に知っていただきたいという想いから、はじまりました。
ZOZO,部活動支援制度,部活動に対して、活動費用の一部を会社で支給する制度です。共通のスポーツや趣味など、社員同士のコミュニティ作りを支援しています。
ZOZO,職務発明制度,特許等を取得した発明やデザインに携わった社員に対し、報奨金を支給する制度です。
ZOZO,ソウゾウのナナメウエAWARD,ZOZOらしさ（愛・日々進歩）を踏まえた、ソウゾウのナナメウエな発想や取り組みを社内で募集しMVPを決定、表彰および賞品授与をおこないます。
ZOZO,人事考課制度,"「ZOZOらしさを進化させる人事制度」をコンセプトに、バリュー（ZOZOらしさ）を軸とした人事制度を運用しています。等級定義・バリュー行動・目標に対するパフォーマンス（成果や行動）の総合評価で、処遇を年2回決定。役職と等級が完全連動ではない設計や、等級ごとに細かく設けられた職能給レンジにより、評価結果に応じた柔軟な昇給が可能です。
また、一定の等級からは、マネジメントまたはスペシャリストのキャリアを選択できるため、個人の特性や能力を最大限生かせるキャリア選択と評価実施が可能な仕組みです。"
ZOZO,日々進歩手当,"ZOZOらしさの1つとして掲げている「日々進歩」の実現に向け、昨日より今日、今日より明日と着実に社員一人ひとりが安心して日々進歩できるよう、自己成長を目的に支給される手当です。支給額は、在籍期間が半年経過するごとに2,500円ずつ増額し、最大で月10万円を支給します。"
ZOZO,社内公募制度,新サービスの立ち上げや事業拡大により増員が必要になった際に、該当部署が募集をかけ、社員が自由に応募できる制度です。応募後は、課題や面談等を経て選考に合格すると、部署異動が決定します。（年1回実施）
ZOZO,1on1ミーティング,上長と部下が定期的に1対1でミーティングを実施し、上長が部下の直面している課題の解決や目標達成への支援を行っています。
ZOZO,LYアカデミア,LINEヤフーグループの企業内大学です。グループのトップリーダーが集まるクラスや、グループ会社の社員であれば誰でも参加できるプログラムなどが実施されています。
ZOZO,クラウドトレーニング費用補助制度,AWSのインフラ演習「TCP/IP（Try Cloud Program / Infrastructure Practice）」の利用補助制度です。学習用途として、毎月100ドルまでAWS環境を自由に使用することができ、実際に触れることでコスト管理も意識しながら、スキルアップを目指すことができます。
ZOZO,社会人ドクター制度,会社が認めた場合に、働きながら博士号の取得を希望する者に対し、給与とは別に修了に必要な学費を支援する制度です。
ZOZO,セミナー・カンファレンス参加支援,海外カンファレンスを含む勉強会やセミナーの参加費用（渡航費・現地滞在費含む）を会社で補助しています。
ZOZO,書籍購入支援,業務関連性の高い書籍を購入する際に、会社で費用を負担しています。
ZOZO,各種休暇,慶弔休暇（パートナーの性別にかかわらず結婚と同等の手続き完了時5日、パートナーの出産時3日等）のほかに、子供の看護休暇（中学校就学まで取得可）や介護休暇なども利用できます。
ZOZO,家族時短制度,業務とプライベートをバランスよく充実させるため、育児や介護はもちろん、ペットや同居人など社員が「家族」と認識する人や動物のサポートが必要な場合は、1日最大2時間の時短利用が可能です。時短は30分単位から利用できます。
ZOZO,慶弔見舞金制度,従業員や家族の慶弔時には、祝い金、もしくは見舞金等を支給します。
ZOZO,家族手当,"扶養家族1名につき毎月5,000円が支給されます。"
ZOZO,ベビーシッター利用補助制度,国の助成制度である「ベビーシッター派遣事業」に基づき、ベビーシッター派遣事業割引券を交付する制度。従業員が指定されたベビーシッターのサービスを利用した際に、支払う利用料金の一部または全部を国と会社で負担するものです。
CARTA HOLDINGS,スーパーフレックス&ハイブリッドワーク,チームや業務に合わせて、働く時間帯と場所(リモートワーク/オフィス出社)を選択し使い分けています。パフォーマンスとワークライフバランスを考えて働く時間帯を調整します。
CARTA HOLDINGS,ヒトノワラリー,入社時や異動時、あるいは思い立った時に、1on1形式で行う15〜30分間のフリートークです。基本的に次の人を紹介してもらうラリー形式で、社内では「ヒトノワラリー」として親しまれています。
CARTA HOLDINGS,CARTA CAMP,部署や職種を超えてチームを組み、経営課題を抽出。解決プランを提案します。議論などの準備に約一ヶ月間かけるイベントで、毎年開催しています。最終日の経営陣に向けてプレゼンし、実施可否を決定します。
CARTA HOLDINGS,DASH,誰でも応募できる新規事業開発プログラムです。応募された案はCARTAボードメンバー全員で目を通し、事業化が検討されます。ビジネスコンテストではなく、CARTAの未来を創る事業開発プロセスです。
CARTA HOLDINGS,CARTA EVOLUTiON PROGRAM,持続的な「事業成長」と「事業創出」を目的とした仕組みです。事業のステージを可視化して全社共有。マイルストーン達成時にはインセンティブを設け、祝う文化を促進しています。
CARTA HOLDINGS,バリューフィードバック,CARTAが大切にしている「バリュー」に沿って、役職や所属を超えてフィードバックし合う仕組みです。事業目標からは見えづらい部分がわかり、自身とチームの成長機会として活用されています。
CARTA HOLDINGS,技術力評価会,エンジニアの評価軸の一つである技術力を評価します。裁量とチャレンジに、自身の振り返りと評価会のフィードバック。これらのかけあわせが個人の進化を加速します。多彩な仲間からの視点を吸収する機会です。
CARTA HOLDINGS,DIVE,自ら部署を超えた異動にチャレンジできる機会と支援を提供する制度です。多くの事業があるCARTAだからこそ、自身のキャリアと会社の進化を結びつけるチャンスが広がります。
CARTA HOLDINGS,サークル,共通の興味を介したコミュニケーションとリフレッシュができるサークル制度があります。約20のサークルがあり、活動費の補助があります。参加は任意ですが、社内のつながりづくりに役立っています。
sansan,Know Me,部内、部外のメンバーが三人一組で飲み会やランチをすると、飲食費が補助されます。互いの業務内容やどのような考えを持っているのかを話しながら、気軽に社内交流を図ることができます。お酒を飲まないメンバーにも利用されている制度です。
sansan,Geek Seek,エンジニア職や研究開発職、クリエイター職などのメンバーは、知識の習得や業務効率向上にかかる費用が補助されます。ソフトウエアとハードウエア合わせて年5万円まで必要なものを自由に選んで購入できるほか、書籍の購入費、勉強会の補助、有料イベントの参加費用なども対象です。
sansan,H2O,自宅の最寄り駅が表参道駅または渋谷駅から2駅以内の場合に、家賃にかかる費用の一部として補助が受けられます。通勤のストレスを減らして「生産性を維持したい」「もっと業務に向き合いたい」という声に応えて始まった制度です。
sansan,よいこ,メンバーが自発的に企画、実施する「社内部活動」を後押しします。活動を通して、他部門のメンバーと楽しみながら交流することで、業務でも声を掛けやすくなり、連携も取りやすくなります。参加条件はなく、複数のグループに参加することもできます。
sansan,ブランチ,入社1年目の間、新卒入社のメンバーは「ブラザー」「シスター」と呼ばれる先輩社員とペアを組み、月に1回ランチに行く時間が設けられます。業務の話だけでなく、私生活を含めた社会人生活全般についても相談することができ、自身の成長を促すサポートを受けられます。
sansan,M2O,新卒のメンバーが入社時に表参道駅または渋谷駅から2駅以内に引っ越した場合、新生活を始めるための費用として一律で33万円が支給されます。新生活にかかる費用を会社が一部負担することで、より良いスタートダッシュが切れるように後押しします。
sansan,コーチャ,小学校6年生までの子どもがいるメンバーを対象にした、仕事と子育ての両立を後押しする制度です。ベビーシッターや学童保育、家事代行といった子育てをサポートするサービスの利用や、子どものワクチン接種などに対して、毎月一定額の補助が受けられます。
sansan,OCEAN,英語学習にかかる費用を補助します。英会話のレッスン費やTOEICの受検料、英語学習に必要な雑誌・アプリなどの購入費などが対象です。補助を受けられる期間は1年間と設定されますが、英語スキルが向上していると認められれば期間を延長できます。
sansan,OYACO,小学校6年生までの子どもがいるメンバーを対象にした、仕事と子育ての両立を後押しする制度です。ベビーシッターや学童保育、家事代行といった子育てをサポートするサービスの利用や、子どものワクチン接種などに対して、毎月一定額の補助が受けられます。
