company_name,title,content
freee,freeeの現状と今後の戦略,日本国内には約660万社のスモールビジネスが存在し、クラウドの浸透率にも大きな余地があります。このような中で、freeeは、日本で唯一のスモールビジネス向け「統合型経営プラットフォーム」として、提供するプロダクト価値を最重要とする戦略で成長を目指していきます。個々のプロダクトの強化とプロダクト同士のつながりがうみだす統合体験により、あらゆる顧客ニーズに対応していきます。
ZOZO,企業理念,世界中をカッコよく、世界中に笑顔を。
CARTA HOLDINGS,MISSION | The Evolution Factory,"私たちは「進化」を生み出す。
変わろうとするすべての組織に。
知ってもらえずにいる商品たちに。
力を眠らせたままのあらゆる産業に。

よくする、だけでは足りない。
次のステージへのジャンプを起こす。
つながりえなかったものをつなぎ、
停滞していたものを動かす。
そんな進化を、あらゆる場所につくっていく。

そのためには、「多様な力」が必要だ。
違う才能がぶつかりあい、
自分だけでは想像もできなかった方法に
辿りつく必要がある。
だから私たちは、意志を持って、
様々な人間が共存する。
挑もうとする人と進化を起こすために。

私たちは進化推進業、
CARTA HOLDINGSです。"
CARTA HOLDINGS,VALUE,"1. 挑戦しよう。
挑戦しよう。日々のちょっとしたことでもいい。できなそうなことに一歩近づいてみよう。挑戦は、たとえ失敗しても、大切な学びになる。その学びは、いつか必ず「何か」につながる。だから、挑戦する集団でいよう。挑戦している仲間をたたえ、励まし、サポートしよう。

2. すべてを、自分ごとに。
仕事が「自分ごと」になるとき、仕事の質が上がり、何より仕事がおもしろくなる。「自分ならどうするか」「どう変えられるか」主体的に問いつづけることで、「こなすこと」を「熱中できること」に変え、意志のこもった仕事にしよう。

3. スピードは力。
時代と産業に進化を生み出そうとするとき、スピードは常に価値になる。走りながら決めて進めていく仕事でも、着実性を積み上げる仕事でも、スピードによって進化のきっかけが生まれ、顧客が安心する。私たちにとって、スピードは生命線であり、誠実さでもある。速く動くことはもちろん、スピードを力に変えることを、常に考えつづけよう。

4. 
全誠実でいよう。全誠実でいよう。
顧客に、ユーザーに、生活者に、仕事の仲間に、家族に、自分自身に、すべての相手に、誠実でいよう。短期的な成果に流されず、中長期的視点で、社会や世界を考えることも誠実さだ。人だけでなく、社会と未来に対しても誠実であろう。

5. 違いを強さに。
みんなの違いが相乗効果を生み、進化を起こし、ひとりではたどり着けない新しい時代をつくる。たがいの「違い」を知り、生かしていこう。相手の強みを見出し、認めて、その力を受け取ろう。一人ひとりが、自分らしさで貢献しよう。

6. 超えよう。
顧客やユーザー、仲間の想像の上をいくような、発想や行動を大切にしよう。言われたことの「その先」を考えよう。「思いもよらなかったこと」が、人の気持ちを動かし、期待を超える成果を生み出す。だから、誠実さも、自分らしさも、スピードも総動員して、期待を超えていこう。

7. いつだって楽しく。
仕事には、大変な時もある。問題もたくさんある。でも、どんなときも、どうやれば楽しくできるかと考える人でいよう。本当に真剣になれる仕事は、最高に楽しめる仕事。一人ひとりが楽しむことこそが、人の進化を生み出し、チームの進化になり、やがて社会をよりよいものへ進化させていく。この仕事を、この時代を、楽しもう。"
sansan,Mission | 出会いからイノベーションを生み出す,"出会いからイノベーションを生み出す
いつの時代も、世界を動かしてきたのは出会いです。
人と人、企業と企業、その出会いの連鎖が社会を前進させます。

私たちは出会いが持つ可能性を再発見し、
未来につなげることでビジネスを変えていきます。

イノベーションにつながる新しい出会いを生み出す。
出会いの力でビジネスの課題にイノベーションを起こす。
そして、ビジネスの出会い、そのもののあり方を変えていきます。"
sansan,Vision | ビジネスインフラになる,"水を通す道、電気やガス、インターネットを通す道。
誰もが利用するさまざまな道が、生活のインフラとして人々を支えています。

私たちはビジネスという世界において、
誰も考えつかなかったような新たな道になろうとしています。

これまで行けなかった場所。見たこともない景色。それを現実のものにする。

ビジネスの中で誰もが毎日のように通るその道は、
人と人、企業と企業をつなぎ、イノベーションを生み出していくのです。"
sansan,Values | 仕事に向き合い、情熱を注ぐ,"私たちが向き合っているのは、いまはまだ存在しない新しい当たり前をつくることです。 それは道なき道を切り拓くように、とても壮大で一朝一夕に実現できることではありません。 薄皮を一枚一枚重ねるように、小さな努力を一つずつ積み重ね、目の前の仕事に本気で向き合った先にこそ実現できるものです。 だからこそ、他の誰でもない私たち自身の強い想いを、目の前の仕事やプロダクトに注ぎ、少しずつ育てていくことが重要だと考えています。

Lead the customer
イノベーションとは、これまでの常識を覆すようなものです。 世の中の常識ばかりに目を向けていては、決して実現できません。 そんな誰もが体験したことのない新しい世界へ、そっと導いていくのが私たちです。 誰もが想像さえしなかった場所に、新しい道を切り拓き、目指す未来に対して本当に価値あるものを提供し続けることが、私たちのあるべき姿なのです。

体験を想像する
誰かの行動を促すためには、想像力を最大限に発揮する必要があります。 体験の当事者となったとき、そこに違和感はないのか、本当にそれは現実的なのか。 誰もが迷うことなく通れる道でなければ、正しい目的地へ導くことはできません。 一般論や机上の空論ではなく、本質をついたものを提供するために、私たちが関わるあらゆる体験において大切にしていることです。

意思と意図をもって判断する
道を切り拓くのは他の誰でもない私たち自身です。 誰かが決めたことを盲目的に遂行するのではなく、どうすべきかを一人ひとりが判断するのです。 私たちはどこへ向かっているのか、どうなりたいのか、そのためにはどうすべきなのか。 一人ひとりの意思と意図が当社を動かし続けています。 そこに意思と意図はあるのか、その問いかけこそが新しい価値を生み出す原動力となっています。

最速を目指す
物事を実行するとき、最速でありたい。 それは何も考えずに走るということでも、反射的に行動するということでもありません。 常に最速でやり遂げる方法を考え、動いていくということだと思います。 この場所に最速で道を通すにはどうするべきなのか。 考え抜いた末に、ときには立ち止まることも必要かもしれません。 何かを強制するような話ではなく、いまよりも、さらに良くしようという最速を「目指す」考え方です。

強みを活かし、結集する
私たちの向き合う仕事は、一人では成し遂げられないものが数多く存在しています。 しかし、それぞれが持っている強みを結集し、組み合わせることで、 新たな解決策や、新しい道を切り拓く力を生み出せるかもしれません。 目の前の仕事に自身の強みや同僚の強みを活かし、それぞれの持っている能力を最大限に発揮し合うことで、切り立った崖すらも道に変えることができると考えています。

感謝と感激を大切にする
私たちがこれまで切り拓いてきた道は、決して一人でつくってきたものではありません。 さまざまな部門・役割のメンバーが互いに協力し、ひとつずつ形にしてきました。 しかし、インフラと呼ぶにはまだ遠く、目指す未来を現実のものにするためには、全員の協力が必要不可欠です。 だからこそ、同僚が最高の成果を生み出し続けてくれることに感謝し、ときには一緒に喜び、同じミッションやビジョンを目指すことのできる7人8脚の精神を大切にしています。

変化を恐れず、挑戦していく
想像を超える変化にはリスクが伴います。 そのリスクを正しく認識していなければ、成果を得ることはできません。 変化すること・挑戦することが目的ではなく、その先に何を得るのかが重要です。 議論の末、変化しないということもまた一つの結論かもしれません。 その先にある恐れを認識しながら、それでも挑戦していく。 私たちはいつも、道なき道を切り拓く挑戦者であることを忘れてはいけません。"
sansan,Premise | セキュリティと利便性を両立させる,セキュリティは私たちにとっての前提条件です。セキュリティなくして私たちは存続しえません。 一方で、私たちが提供するクラウドサービスは世の中をより便利にするためのもので、多くのケースでセキュリティと利便性は相反します。 大事なことは、天秤を「セキュリティ」や「利便性」に傾かせることなく、双方を高度にバランスさせていくことだと捉えています。
リクルート,基本理念,私たちは、新しい価値の創造を通じ、社会からの期待に応え、一人ひとりが輝く豊かな世界の実現を目指す。
リクルート,ビジョン | Follow Your Heart,一人ひとりが、自分に素直に、自分で決める、自分らしい人生。本当に大切なことに夢中になれるとき、人や組織は、より良い未来を生み出せると信じています。
リクルート,ミッション | まだ、ここにない、出会い。より速く、シンプルに、もっと近くに。,"私たちは、個人と企業をつなぎ、より多くの選択肢を提供することで、「まだ、ここにない、出会い。」を実現してきました。
いつでもどこでも情報を得られるようになった今だからこそ、より最適な選択肢を提案することで、「まだ、ここにない、出会い。」を、桁違いに速く、驚くほどシンプルに、もっと身近にしていきたいと考えています。"
リクルート,バリューズ,"新しい価値の創造 / Wow the World
世界中があっと驚く未来のあたりまえを創りたい。遊び心を忘れずに、常識を疑うことから始めればいい。良質な失敗から学び、徹底的にこだわり、変わり続けることを楽しもう。

個の尊重 / Bet on Passion
すべては好奇心から始まる。一人ひとりの好奇心が、抑えられない情熱を生み、その違いが価値を創る。すべての偉業は、個人の突拍子もないアイデアと、データや事実が結び付いたときに始まるのだ。私たちは、情熱に投資する。

社会への貢献 / Prioritize Social Value
私たちは、すべての企業活動を通じて、持続可能で豊かな社会に貢献する。
一人ひとりが当事者として、社会の不に向き合い、より良い未来に向けて行動しよう。"
LINEヤフー,ミッション, 「WOW」なライフプラットフォームを創り、日常に「！」を届ける
LINEヤフー,バリュー,"ユーザーファースト
日々の業務において、「ユーザーが求めているのか」「ユーザーがより便利になるのか」
この 2つを常に判断の軸としてください。
ユーザーの関心と選択があってこそ、プロダクトは使ってもらえます。
また、ユーザーのニーズは変化し続けるものです。
世の中のあらゆることにアンテナを張りましょう。
ユーザーを取り巻く環境は、競合、市況、技術進歩など様々な因子で相対的に変化します。
ユーザーから見て私たちの会社やプロダクトがどう映るのかを俯瞰で見つめる力が必要です。
その結果として、ユーザーに選ばれるプロダクトを提供できるのです。

やりぬく
私たちの仕事には、複雑で多様な課題が日々発生します。
それぞれ難易度が高く、簡単に解決できるものではありません。
そんなときは、できない理由ではなく、できる方法を模索するスタンスを忘れないでください。
考えうるすべての方法を試し、後悔なく全力を尽くせば、
たとえ失敗したとしても、その経験は次の挑戦を成功に導く糧になるでしょう。
成功するその日まで、やりぬくのです。

少数精鋭
少数精鋭の意味するところは
「挑戦する課題に対し、最適化された精鋭組織」です。
人員が少なすぎると、当然プロダクトの完成度は低くなります。
かといって多すぎるとコミュニケーションコストばかりが膨らみ、
適切なタイミングでユーザーに届けることができません。
また、必要なケーパビリティと情熱を持ったメンバーでなければ、
最短距離での業務遂行はできません。
この「挑戦する課題に対し、最適化された精鋭組織」を意識し、
成果を出す組織を創りましょう。"