企業名,title,cocntent
リクルート,理由・回数を問わないリモートワーク,一部の職種を除き、理由・回数を問わないリモートワークを全社導入。出社しないことを前提とした働き方へシフトしております。それに伴い、通勤交通費は実費支給※へと変更。これまで認められていなかった、特急料金も条件付きで許可される場合もあります。これにより遠方通勤もしやすくなるなど、働く場所の柔軟性を高めています。
リクルート,年間平均週休約3日,"一人ひとりが自律的かつ柔軟な働き方を実現できるよう、暦上の休日や有給休暇とは別に「フレキシブル休日」として取得する日を自分で決められる休日を設けています。
年間の休みは合計で145日、平均で週休2.8日（約3日）となります。

※年間の休み145日には、会社休日及び年次有給休暇の計画的付与による指定休5日を含みます。"
リクルート,出産育児休暇,妊娠〜育児期間の多様なシーンで活⽤できる休暇です。男性も利⽤可能。初回付与時点での末⼦の年齢と週所定勤務日数に応じて、最⼤40⽇付与されます。お子様が12歳になる年度の、3月末まで利用可能です。
リクルート,ケア休暇,家族のケアの際に使⽤できる休暇です。介護認定不要で、ペットのケアでも取得可能です。週所定勤務日数に応じて、最⼤年5⽇付与されます。
リクルート,ストック休暇,"年次有給休暇の未消化分を、上限40⽇積⽴できる休暇です。

※病気・育児・不妊治療・介護・慶弔・ボランティア等の限定した取得要件があります。"
リクルート,STEP休暇,"在籍3年ごとに1回取得できる休暇です。暦⽇で14〜28⽇（休⽇を含む）の範囲で任意に取得可能です。

※連続で取得することが必須。"
リクルート,アニバーサリー⼿当,4月1日時点で在籍1年以上の社員を対象に、年次有給休暇を連続4日以上利用することで5万円が支給されます。1年度で1回、毎年度利用が可能です。
LINEヤフー,懇親会費用補助,月1回まで、懇親会費用をサポートしています（費用上限あり）。 チーム・部門・プロジェクトといった業務関係者とのコミュニケーションのため、利用を推奨しています。
LINEヤフー,サークル活動,各種サークル活動も盛んで、希望者はサークルへの入部が可能です。 活動サークルは半期ごとに人数・活動内容に応じて、会社から補助金を支給しています。
LINEヤフー,社員の健康維持・向上,会社が実施する健康診断では、法定項目の実施に加え、一部の検査メニューは自己負担なく受診できます。 また健康診断後に再検査が必要になった場合、再検査にかかる費用を会社が負担します（上限2万円/年）。
LINEヤフー,感染症の特別休暇,会社が定めた感染症（インフルエンザ・新型コロナウイルス感染症を含む）に罹患した場合、指定日数分の特別休暇の取得が可能です。
LINEヤフー,選択型確定拠出年金制度,LINEヤフーの選択型確定拠出年金制度とは、会社負担の掛金に加え、加入者である社員が自らの賞与の一部を拠出・運用し、その運用の結果次第で将来受け取る年金額が変動する年金制度です。 少子高齢化が進み公的年金の財政が厳しくなるなか、確定拠出年金の果たす役割は日々高まっています。 LINEヤフーは、社員の豊かな老後を支えるために、この制度を導入しています。
LINEヤフー,財産形成貯蓄制度（財形）,社員の希望する金額を毎月の給与や賞与から天引きし、財形取扱機関に預け入れを行う貯蓄制度です。社員は、定期的な積み立てによる貯蓄ができ、その積立金に加え、会社からの奨励金があります。なお、財形貯蓄には、一般財形・住宅財形・年金財形の3種類があります。
LINEヤフー,株式累積投資制度（るいとう）,毎月一定の金額を継続的に積み立てる形で買い付ける株式投資の方法です。 LINEヤフーでは、福利厚生のひとつとして「るいとう」を利用した株式（LINEヤフー株式会社）の購入を給与からの積み立てで行うことができ、その積立金に加え、会社からの奨励金があります。 長期的な資産形成の手段のひとつとして活用できます。
LINEヤフー,長期所得補償制度,病気やけがで一定の免責期間を超えて仕事ができなくなった場合、標準報酬月額の60％を満60歳まで補償する制度です。 病気やけがで欠勤・休職した場合、健康保険組合から傷病手当金として給与の3分の2が18カ月間支給された後は、収入が途絶えてしまいます。 その期間以降もサポートできるようにしています。
LINEヤフー,総合福祉団体定期保険（遺族生活保障制度）,"社員に不慮の事態が生じた場合に備え、ソフトバンクグループ団体定期保険に加入しています。 保険料は会社が全額負担し、万が一の場合に保険金額（合計1,000万円）を遺族等に支払います。保険金とは別に、子女に対して、会社から加算金を支払います。（小学生以下 500万円/人、中高生 250万円/人）"
LINEヤフー,社員向け研修制度,"希望者にビジネススキル研修と「GLOBIS学び放題」を無償で提供しています。 社員がより主体的にキャリアを考え、さらなる成長に向けた一歩を踏み出せるよう、キャリア研修を通じて、一人ひとりの自己理解の深化、今後のキャリアイメージの具体化をサポートしています。
キャリアステージごとの悩みに応じて、これまでの仕事経験やキャリア資産の振り返り、および自身のキャリア開発の指針を見つけ、ありたい姿を具体化していきます。"
LINEヤフー,LINEヤフーアカデミア,「次世代リーダーの創出」を目的とする企業内大学「LINEヤフーアカデミア」の受講も可能です。 「自立」をテーマに、チームをリード、社会をドライブし活躍する人材になることを目指しています。 LINEヤフーの現経営層である執行役員が各クラスのメンターとなり、受講者と真剣に向き合い、未来を創るリーダー候補の社員を直接指導・支援するのが特徴です。
LINEヤフー,語学研修,業務上必要となる方に英語・韓国語・日本語の語学講座を開講します。 全額会社負担で受講が可能です。
LINEヤフー,マネジメント研修,組織成果最大化の鍵を握る役職者への育成コンテンツを提供しています。
LINEヤフー,社内公募,入社から一定期間が経過した社員を対象に、社内で公開されている募集ポジションに応募できる制度があります。 希望ポジションの選考に合格した場合のみ、応募者の情報が現所属上長に開示され、引き継ぎ等を行ったうえで異動となります。 自らの意思で、キャリアアップや能力開発に生かせます。
LINEヤフー,サバティカル休暇,自らのキャリアや経験、働き方を見つめなおし、考える機会をつくることで、本人のさらなる成長につなげることを目的とした休暇制度です。 勤続10年以上の正社員を対象に、2～3カ月の範囲で取得可能です。 なお、休暇期間中、一定期間は会社が支援金を支給します。